"(Make sure you keep it in a safe place.)","(Assurez-vous de la garder dans un endroit sûr)"
"(Optional. Leave blank for no prefix)","(Optional. Leave blank for no prefix)"
"(ver. %s)","(ver. %s)"
"After successfull installation please click the button below.","After successfull installation please click the button below."
"All packages were installed successfully, click 'Ok' to continue with installation","All packages were installed successfully, click 'Ok' to continue with installation"
"Alternatively you could try the 'Manual Downloads and Upgrades' method.","Alternatively you could try the 'Manual Downloads and Upgrades' method."
"Before you continue to your store, please make a note of your encryption key (Magento uses it to encrypt passwords, credit cards and more).","Avant de continuer vers votre magasin, veuillez noter votre clé de cryptage (Magento l'utilise pour crypter les mots de passe, les numéros de cartes de crédit, ...)"
"Check out our","Jetez un oeil à notre"
"Check this box only if it is not possible to automatically validate Secure URL, for example if HTTP authentication is required.","Check this box only if it is not possible to automatically validate Secure URL, for example if HTTP authentication is required."
"Choose this if you would like to test frontend and backend functionality.","Choose this if you would like to test frontend and backend functionality."
"Configuration","Configuration"
"Confirm Password","Confirmer le mot de passe"
"Connection","Connexion"
"Continue","Poursuivre"
"Continue After Manual Download","Continue After Manual Download"
"Continue SVN Installation","Continue SVN Installation"
"Create Admin Account","Créer un compte administrateur"
"Currently this is the most stable state available for Magento packages.","Currently this is the most stable state available for Magento packages."
"Database Connection","Connexion à la base de données"
"Database Name","Nom de base de données"
"Database connection error","Erreur de connexion à la base de données"
"Database host","Serveur de base de données"
"Database user name","Nom d'utilisateur de la base de données"
"Database user password","Mot de passe utilisateur de base de données"
"Default Currency","Devise par défaut"
"Download Magento Core Modules and Updates","Download Magento Core Modules and Updates"
"Downloading and installing Magento, please wait...","Downloading and installing Magento, please wait..."
"Email","Email"
"Email Address","Adresse email"
"Enable this option only if you have SSL available.","Enable this option only if you have SSL available."
"Encryption Key","Clé de cryptage"
"First Name","Prénom"
"Get ready to experience Open-Source eCommerce Evolved.","Préparez-vous à vivre une expérience avancée de l'eCommerce Open-Source"
"Go to Backend","Aller vers le back office"
"Go to Frontend","Aller vers le front office"
"Having trouble installing Magento?","Vous rencontrez des problèmes pour installer Magento ?"
"Help Us to Keep Magento Healthy","Aidez-nous à maintenir Magento"
"Host","Serveur"
"I agree to the above terms and conditions","J'accepte les termes et conditions ci-dessus"
"If you are a developer and would like to have the latest public updates, choose this option.","If you are a developer and would like to have the latest public updates, choose this option."
"If you are running PHP as CGI, your PHP processes may run under the same user as the user you used when uploading Magento files.","If you are running PHP as CGI, your PHP processes may run under the same user as the user you used when uploading Magento files."
"If you are running install wizard over previously downloaded and installed Magento installation, proceed with this method.","If you are running install wizard over previously downloaded and installed Magento installation, proceed with this method."
"If you do not wish or are not able to have Magento folders writeable for the web process, you could use PEAR executable located in the root of Magento installation.","If you do not wish or are not able to have Magento folders writeable for the web process, you could use PEAR executable located in the root of Magento installation."
"If you have installed Magento through SVN, you should skip packages installation and validation by clicking the button below.","If you have installed Magento through SVN, you should skip packages installation and validation by clicking the button below."
"If you wish to manage Magento packages through the web admin interface, you will need to have web writeable permissions applied to all Magento folders and files.","If you wish to manage Magento packages through the web admin interface, you will need to have web writeable permissions applied to all Magento folders and files."
"If your server is running on MS Windows, most probably you will not need to change anything.","If your server is running on MS Windows, most probably you will not need to change anything."
"In other cases you will need to make Magento files writeable for the user that the web server process is running under.","In other cases you will need to make Magento files writeable for the user that the web server process is running under."
"Installation","Installation"
"Installation Guide","Guide d'installation"
"Last Name","Nom de famille"
"Locale","Profil local"
"Locale settings","Réglages de locale"
"Localization","Localisation"
"Login Information","Information de connexion"
"Magento","Magento"
"Magento Installation Wizard","Assistant d'installation Magento"
"Magento uses this key to encrypt passwords, credit cards and more. If this field is left empty the system will create an encryption key for you and will display it on the next page.","Magento uses this key to encrypt passwords, credit cards and more. If this field is left empty the system will create an encryption key for you and will display it on the next page."
"Magento&trade; is a registered Trademark of Irubin Consulting Inc. DBA Varien. &copy; Copyright 2007","Magento&trade; is a registered Trademark of Irubin Consulting Inc. DBA Varien. &copy; Copyright 2007"
"Manual Downloads and Upgrades","Manual Downloads and Upgrades"
"One from PHP Extensions ""%s"" must be loaded","Une des extensions PHP ""%s"" doit être chargée"
"PHP Extension ""%s"" must be loaded","L'extension PHP ""%s"" doit être chargée"
"PHP Extension '%s' loaded","Extension PHP '%s' chargée"
"Package Management through the Web","Package Management through the Web"
"Password","Mot de passe"
"Password Confirmation","Confirmation du mot de passe"
"Path ""%s"" must be writable","Le chemin ""%s"" doit autoriser l'écriture"
"Personal Information","Informations personnelles"
"Please make sure that <code>mod_rewrite</code> is enabled in Apache configuration.","Please make sure that <code>mod_rewrite</code> is enabled in Apache configuration."
"Please note that it is much less stable than beta.","Please note that it is much less stable than beta."
"Please note that only UNIX, Linux and Mac OSX shells are currently supported. For Windows use the '%s' option.","Please note that only UNIX, Linux and Mac OSX shells are currently supported. For Windows use the '%s' option."
"Please set all required settings before clicking Continue","Veuillez renseigner tous les réglages obligatoires avant de poursuivre"
"Preferred stability: %s","Preferred stability: %s"
"Proceed With Automatic Download (%s)","Proceed With Automatic Download (%s)"
"Provide a complete base URL for SSL connection. For example: %s","Provide a complete base URL for SSL connection. For example: %s"
"Report All Bugs","Signalez tous les bugs"
"Required Fields","Champs obligatoires"
"Run admin interface with SSL","Run admin interface with SSL"
"Run this in your shell from Magento root folder:","Run this in your shell from Magento root folder:"
"SVN Installation","SVN Installation"
"Secure Base URL","Secure Base URL"
"Setting preferred state to: %s","Setting preferred state to: %s"
"Skip Secure URL validation before next step","Skip Secure URL validation before next step"
"Tables Prefix","Tables Prefix"
"There was a problem installing Magento packages. Please read the log, correct errors and retry again.","There was a problem installing Magento packages. Please read the log, correct errors and retry again."
"This Url is invalid","Cette url est non valide"
"Time Zone","Fuseau horaire"
"Url ""%s"" is invalid","L'url ""%s"" est non valide"
"Url ""%s"" is not accessible","L'url ""%s"" n'est pas accessible"
"Use Secure URLs (SSL)","Use Secure URLs (SSL)"
"Use Web Server (Apache) Rewrites","Use Web Server (Apache) Rewrites"
"User Name","Nom d'utilisateur"
"User Password","Mot de passe utilisateur"
"Username","Nom d'utilisateur"
"Web access options","Web access options"
"Welcome to Magento's Installation Wizard","Bienvenue dans l'interface d'installation de Magento"
"You can specify server port, ex.: localhost:3307<br/>If you are not using default UNIX socket, you can specify it here instead of host, ex.: /var/run/mysqld/mysqld.sock","Vous pouvez spécifier un port de serveur, par ex: localhost:3307<br/>Si vous n'utilisez pas la socket UNIX par défaut, vous pouvez le spécifier ici à la place de l'hôte, par ex: /var/run/mysqld/mysqld.sock"
"You could enable this option to use web server rewrites functionality for improved search engines optimization.","You could enable this option to use web server rewrites functionality for improved search engines optimization."
"You're All Set","Vous avez terminé la configuration"
